url,crawl_status,status_code,content_type,h1,page_title,meta_description,canonical_tag,robots_txt,redirect_url,meta_robots,x_robots_tag
https://www.stock2own.com/StockAnalysis/ETP/US/CSP/American-Strategic-Income-Portfolio-III?w=x,canonicalised,200,text/html; charset=utf-8,American Strategic Income Portfolio III,American Strategic Income Portfolio III (CSP) quotes and price charts | Stock2Own.com,,http://www.stock2own.com/,allowed,,,
https://www.stock2own.com/StockAnalysis/ETP/US/SZO/PowerShares-DB-Crude-Oil-Short-ETN?w=x,canonicalised,200,text/html; charset=utf-8,PowerShares DB Crude Oil Short ETN,PowerShares DB Crude Oil Short ETN (SZO) quotes and price charts | Stock2Own.com,,http://www.stock2own.com/,allowed,,,
https://www.stock2own.com/StockAnalysis/ETP/US/PWO/PowerShares-XTF-Dynamic-OTC-Portfolio?w=x,canonicalised,200,text/html; charset=utf-8,PowerShares XTF: Dynamic OTC Portfolio,PowerShares XTF: Dynamic OTC Portfolio (PWO) quotes and price charts | Stock2Own.com,,http://www.stock2own.com/,allowed,,,
https://www.stock2own.com/StockAnalysis/ETP/US/TYN/Tortoise-North-American-Energy-Corp?w=x,canonicalised,200,text/html; charset=utf-8,Tortoise North American Energy Corp,Tortoise North American Energy Corp (TYN) quotes and price charts | Stock2Own.com,,http://www.stock2own.com/,allowed,,,
https://www.stock2own.com/StockAnalysis/ETP/US/BHD/BlackRock-Strategic-Bond-Trust?w=x,canonicalised,200,text/html; charset=utf-8,BlackRock Strategic Bond Trust,BlackRock Strategic Bond Trust (BHD) quotes and price charts | Stock2Own.com,,http://www.stock2own.com/,allowed,,,
https://www.stock2own.com/StockAnalysis/ETP/US/XAA/American-Municipal-Income-Portfolio?w=x,canonicalised,200,text/html; charset=utf-8,American Municipal Income Portfolio,American Municipal Income Portfolio (XAA) quotes and price charts | Stock2Own.com,,http://www.stock2own.com/,allowed,,,
https://www.stock2own.com/StockAnalysis/ETP/US/DPD/Dow-30-Premium-Dividend-Income-Fund?w=x,canonicalised,200,text/html; charset=utf-8,Dow 30 Premium & Dividend Income Fund,Dow 30 Premium & Dividend Income Fund (DPD) quotes and price charts | Stock2Own.com,,http://www.stock2own.com/,allowed,,,
https://www.stock2own.com/StockAnalysis/StockLookup/US?searchStr=SPU.UN,canonicalised,200,text/html; charset=utf-8,Stock and Index Lookup,"Stock Lookup: search stock, index or ETF by name of symbol",,http://www.stock2own.com/,allowed,,,
https://www.stock2own.com/StockAnalysis/ETP/US/SPU.UN/Sustainable-Production-Energy-Trust?w=x,found,302,text/html; charset=utf-8,,,,,allowed,https://www.stock2own.com/StockAnalysis/StockLookup/US?searchStr=SPU.UN,,
https://www.stock2own.com/StockAnalysis/StockLookup/US?searchStr=CEF.A,canonicalised,200,text/html; charset=utf-8,Stock and Index Lookup,"Stock Lookup: search stock, index or ETF by name of symbol",,http://www.stock2own.com/,allowed,,,
https://www.stock2own.com/StockAnalysis/ETP/US/CEF.A/Central-Fund-of-Canada-Ltd?w=x,found,302,text/html; charset=utf-8,,,,,allowed,https://www.stock2own.com/StockAnalysis/StockLookup/US?searchStr=CEF.A,,
https://www.stock2own.com/StockAnalysis/ETP/US/MBG/SPDR-Barclays-Capital-Mortgage-Backed-Bond-ETF?w=x,canonicalised,200,text/html; charset=utf-8,SPDR Barclays Capital Mortgage Backed Bond ETF,SPDR Barclays Capital Mortgage Backed Bond ETF (MBG) quotes and price charts | Stock2Own.com,,http://www.stock2own.com/,allowed,,,
https://www.stock2own.com/StockAnalysis/StockLookup/US?searchStr=HXU,canonicalised,200,text/html; charset=utf-8,Stock and Index Lookup,"Stock Lookup: search stock, index or ETF by name of symbol",,http://www.stock2own.com/,allowed,,,
https://www.stock2own.com/StockAnalysis/ETP/US/HXU/Horizons-BetaPro-S-P-TSX-60-Bull-Plus-ETF?w=x,found,302,text/html; charset=utf-8,,,,,allowed,https://www.stock2own.com/StockAnalysis/StockLookup/US?searchStr=HXU,,
https://www.stock2own.com/StockAnalysis/ETP/US/JSN/Nuveen-Equity-Premium-Opportunity-Fund?w=x,canonicalised,200,text/html; charset=utf-8,Nuveen Equity Premium Opportunity Fund,Nuveen Equity Premium Opportunity Fund (JSN) quotes and price charts | Stock2Own.com,,http://www.stock2own.com/,allowed,,,
https://www.stock2own.com/StockAnalysis/ETP/US/BSP/American-Strategic-Income-Portfolio-II?w=x,canonicalised,200,text/html; charset=utf-8,American Strategic Income Portfolio II,American Strategic Income Portfolio II (BSP) quotes and price charts | Stock2Own.com,,http://www.stock2own.com/,allowed,,,
https://www.stock2own.com/StockAnalysis/StockLookup/US?searchStr=AEU.UN,canonicalised,200,text/html; charset=utf-8,Stock and Index Lookup,"Stock Lookup: search stock, index or ETF by name of symbol",,http://www.stock2own.com/,allowed,,,
https://www.stock2own.com/StockAnalysis/ETP/US/AEU.UN/ACTIVEnergy-Income-Fund?w=x,found,302,text/html; charset=utf-8,,,,,allowed,https://www.stock2own.com/StockAnalysis/StockLookup/US?searchStr=AEU.UN,,
https://www.stock2own.com/StockAnalysis/StockLookup/US?searchStr=INC.UN,canonicalised,200,text/html; charset=utf-8,Stock and Index Lookup,"Stock Lookup: search stock, index or ETF by name of symbol",,http://www.stock2own.com/,allowed,,,
https://www.stock2own.com/StockAnalysis/ETP/US/INC.UN/Income-Financial-Trust?w=x,found,302,text/html; charset=utf-8,,,,,allowed,https://www.stock2own.com/StockAnalysis/StockLookup/US?searchStr=INC.UN,,
https://www.stock2own.com/StockAnalysis/ETP/US/IPE/SPDR-Barclays-Capital-TIPS-ETF?w=x,canonicalised,200,text/html; charset=utf-8,SPDR Barclays Capital TIPS ETF,SPDR Barclays Capital TIPS ETF (IPE) quotes and price charts | Stock2Own.com,,http://www.stock2own.com/,allowed,,,
https://www.stock2own.com/StockAnalysis/ETP/US/BOM/PowerShares-DB-Base-Metals-Double-Short-ETN?w=x,canonicalised,200,text/html; charset=utf-8,PowerShares DB Base Metals Double Short ETN,PowerShares DB Base Metals Double Short ETN (BOM) quotes and price charts | Stock2Own.com,,http://www.stock2own.com/,allowed,,,
https://www.stock2own.com/StockAnalysis/ETP/US/FAA/Claymore-NYSE-Arca-Airline-ETF?w=x,canonicalised,200,text/html; charset=utf-8,Claymore/NYSE Arca Airline ETF,Claymore/NYSE Arca Airline ETF (FAA) quotes and price charts | Stock2Own.com,,http://www.stock2own.com/,allowed,,,
https://www.stock2own.com/StockAnalysis/StockLookup/US?searchStr=MMN.UN,canonicalised,200,text/html; charset=utf-8,Stock and Index Lookup,"Stock Lookup: search stock, index or ETF by name of symbol",,http://www.stock2own.com/,allowed,,,
https://www.stock2own.com/StockAnalysis/ETP/US/MMN.UN/Multi-Manager-Limited-Partnership-I?w=x,found,302,text/html; charset=utf-8,,,,,allowed,https://www.stock2own.com/StockAnalysis/StockLookup/US?searchStr=MMN.UN,,
https://www.stock2own.com/StockAnalysis/ETP/US/PYH/PowerShares-Value-Line-Industry-Rotation-Portfolio?w=x,canonicalised,200,text/html; charset=utf-8,PowerShares Value Line Industry Rotation Portfolio,PowerShares Value Line Industry Rotation Portfolio (PYH) quotes and price charts | Stock2Own.com,,http://www.stock2own.com/,allowed,,,
https://www.stock2own.com/StockAnalysis/StockLookup/US?searchStr=RBS,canonicalised,200,text/html; charset=utf-8,Stock and Index Lookup,"Stock Lookup: search stock, index or ETF by name of symbol",,http://www.stock2own.com/,allowed,,,
https://www.stock2own.com/StockAnalysis/ETP/US/RBS/R-Split-III-Corp?w=x,found,302,text/html; charset=utf-8,,,,,allowed,https://www.stock2own.com/StockAnalysis/StockLookup/US?searchStr=RBS,,
https://www.stock2own.com/StockAnalysis/ETP/US/GTU/Central-GoldTrust?w=x,canonicalised,200,text/html; charset=utf-8,Central GoldTrust,Central GoldTrust (GTU) quotes and price charts | Stock2Own.com,,http://www.stock2own.com/,allowed,,,
https://www.stock2own.com/StockAnalysis/ETP/US/NVN/Nuveen-New-York-Select-Quality-Municipal-Fund?w=x,canonicalised,200,text/html; charset=utf-8,Nuveen New York Select Quality Municipal Fund,Nuveen New York Select Quality Municipal Fund (NVN) quotes and price charts | Stock2Own.com,,http://www.stock2own.com/,allowed,,,
https://www.stock2own.com/StockAnalysis/ETP/US/LFEAX/MFS-Lifetime-2035-A?w=x,canonicalised,200,text/html; charset=utf-8,MFS Lifetime 2035 A,MFS Lifetime 2035 A (LFEAX) quotes and price charts | Stock2Own.com,,http://www.stock2own.com/,allowed,,,
https://www.stock2own.com/StockAnalysis/StockLookup/US?searchStr=SIN.UN,canonicalised,200,text/html; charset=utf-8,Stock and Index Lookup,"Stock Lookup: search stock, index or ETF by name of symbol",,http://www.stock2own.com/,allowed,,,
https://www.stock2own.com/StockAnalysis/ETP/US/SIN.UN/Sciti-Trust?w=x,found,302,text/html; charset=utf-8,,,,,allowed,https://www.stock2own.com/StockAnalysis/StockLookup/US?searchStr=SIN.UN,,
https://www.stock2own.com/StockAnalysis/ETP/US/EMT/Emerging-Global-Shares-Metals-Mining?w=x,canonicalised,200,text/html; charset=utf-8,Emerging Global Shares Metals & Mining,Emerging Global Shares Metals & Mining (EMT) quotes and price charts | Stock2Own.com,,http://www.stock2own.com/,allowed,,,
https://www.stock2own.com/StockAnalysis/ETP/US/RENN/Renaissance-Capital-Growth-and-Income-Fund-III-Inc?w=x,canonicalised,200,text/html; charset=utf-8,Renaissance Capital Growth and Income Fund III Inc.,Renaissance Capital Growth and Income Fund III Inc. (RENN) quotes and price charts | Stock2Own.com,,http://www.stock2own.com/,allowed,,,
https://www.stock2own.com/StockAnalysis/StockLookup/US?searchStr=GBA,canonicalised,200,text/html; charset=utf-8,Stock and Index Lookup,"Stock Lookup: search stock, index or ETF by name of symbol",,http://www.stock2own.com/,allowed,,,
https://www.stock2own.com/StockAnalysis/ETP/US/GBA/GlobalBanc-Advantaged-8-Split-Corp?w=x,found,302,text/html; charset=utf-8,,,,,allowed,https://www.stock2own.com/StockAnalysis/StockLookup/US?searchStr=GBA,,
https://www.stock2own.com/StockAnalysis/ETP/US/PCA/PowerShares-Autonomic-Balanced-NFA-Global-Asset-Portfolio?w=x,canonicalised,200,text/html; charset=utf-8,PowerShares Autonomic Balanced NFA Global Asset Portfolio,PowerShares Autonomic Balanced NFA Global Asset Portfolio (PCA) quotes and price charts | Stock2Own.com,,http://www.stock2own.com/,allowed,,,
https://www.stock2own.com/StockAnalysis/ETP/US/HYV/BlackRock-Corporate-High-Yield-Fund-V-Inc?w=x,canonicalised,200,text/html; charset=utf-8,BlackRock Corporate High Yield Fund V Inc.,BlackRock Corporate High Yield Fund V Inc. (HYV) quotes and price charts | Stock2Own.com,,http://www.stock2own.com/,allowed,,,
https://www.stock2own.com/StockAnalysis/ETP/US/CGRIF/Canadian-General-Investments-Closed-Fund?w=x,canonicalised,200,text/html; charset=utf-8,Canadian General Investments Closed Fund,Canadian General Investments Closed Fund (CGRIF) quotes and price charts | Stock2Own.com,,http://www.stock2own.com/,allowed,,,
https://www.stock2own.com/StockAnalysis/ETP/US/PLK/PowerShares-Active-Low-Duration-Fund?w=x,canonicalised,200,text/html; charset=utf-8,PowerShares Active Low Duration Fund,PowerShares Active Low Duration Fund (PLK) quotes and price charts | Stock2Own.com,,http://www.stock2own.com/,allowed,,,
https://www.stock2own.com/StockAnalysis/ETP/US/LAG/SPDR-Barclays-Capital-Aggregate-Bond-ETF?w=x,canonicalised,200,text/html; charset=utf-8,SPDR Barclays Capital Aggregate Bond ETF,SPDR Barclays Capital Aggregate Bond ETF (LAG) quotes and price charts | Stock2Own.com,,http://www.stock2own.com/,allowed,,,
https://www.stock2own.com/StockAnalysis/ETP/US/DNQ/Vanguard-REIT-ETF-DNQ?w=x,canonicalised,200,text/html; charset=utf-8,Vanguard REIT ETF - DNQ,Vanguard REIT ETF - DNQ (DNQ) quotes and price charts | Stock2Own.com,,http://www.stock2own.com/,allowed,,,
https://www.stock2own.com/StockAnalysis/ETP/US/NNP/Nuveen-New-York-Performance-Plus-Municipal-Fund?w=x,canonicalised,200,text/html; charset=utf-8,Nuveen New York Performance Plus Municipal Fund,Nuveen New York Performance Plus Municipal Fund (NNP) quotes and price charts | Stock2Own.com,,http://www.stock2own.com/,allowed,,,
https://www.stock2own.com/StockAnalysis/ETP/US/JKD/iShares-Morningstar-Large-Core-Index-Fund?w=x,canonicalised,200,text/html; charset=utf-8,iShares Morningstar Large Core Index Fund,iShares Morningstar Large Core Index Fund (JKD) quotes and price charts | Stock2Own.com,,http://www.stock2own.com/,allowed,,,
https://www.stock2own.com/StockAnalysis/ETP/US/HMH/Helios-Multi-Sector-High-Income-Fund?w=x,canonicalised,200,text/html; charset=utf-8,Helios Multi-Sector High Income Fund,Helios Multi-Sector High Income Fund (HMH) quotes and price charts | Stock2Own.com,,http://www.stock2own.com/,allowed,,,
https://www.stock2own.com/StockAnalysis/ETP/US/CYE/BlackRock-Corporate-High-Yield-Fund-III-Inc?w=x,canonicalised,200,text/html; charset=utf-8,BlackRock Corporate High Yield Fund III Inc.,BlackRock Corporate High Yield Fund III Inc. (CYE) quotes and price charts | Stock2Own.com,,http://www.stock2own.com/,allowed,,,
https://www.stock2own.com/StockAnalysis/ETP/US/CFT/iShares-Barclays-Credit-Bond-Fund?w=x,canonicalised,200,text/html; charset=utf-8,iShares Barclays Credit Bond Fund,iShares Barclays Credit Bond Fund (CFT) quotes and price charts | Stock2Own.com,,http://www.stock2own.com/,allowed,,,
https://www.stock2own.com/StockAnalysis/ETP/US/COY/BlackRock-Corporate-High-Yield-Fund-Inc?w=x,canonicalised,200,text/html; charset=utf-8,"BlackRock Corporate High Yield Fund, Inc","BlackRock Corporate High Yield Fund, Inc (COY) quotes and price charts | Stock2Own.com",,http://www.stock2own.com/,allowed,,,
https://www.stock2own.com/StockAnalysis/ETP/US/IFSM/iShares-FTSE-Developed-Small-Cap-ex-North-America-Index-Fund?w=x,canonicalised,200,text/html; charset=utf-8,iShares FTSE Developed Small Cap ex-North America Index Fund,iShares FTSE Developed Small Cap ex-North America Index Fund (IFSM) quotes and price charts | Stock2Own.com,,http://www.stock2own.com/,allowed,,,
https://www.stock2own.com/StockAnalysis/ETP/US/EOSOF/EnerVest-Energy-and-Oil-Sands-Total-Return-Trust?w=x,canonicalised,200,text/html; charset=utf-8,EnerVest Energy and Oil Sands Total Return Trust,EnerVest Energy and Oil Sands Total Return Trust (EOSOF) quotes and price charts | Stock2Own.com,,http://www.stock2own.com/,allowed,,,
https://www.stock2own.com/StockAnalysis/ETP/US/URPTF/Uranium-Participation-Corp?w=x,canonicalised,200,text/html; charset=utf-8,Uranium Participation Corp,Uranium Participation Corp (URPTF) quotes and price charts | Stock2Own.com,,http://www.stock2own.com/,allowed,,,
https://www.stock2own.com/StockAnalysis/StockLookup/US?searchStr=PIC.A,canonicalised,200,text/html; charset=utf-8,Stock and Index Lookup,"Stock Lookup: search stock, index or ETF by name of symbol",,http://www.stock2own.com/,allowed,,,
https://www.stock2own.com/StockAnalysis/ETP/US/PIC.A/Premium-Income-Ord-Shs?w=x,found,302,text/html; charset=utf-8,,,,,allowed,https://www.stock2own.com/StockAnalysis/StockLookup/US?searchStr=PIC.A,,
https://www.stock2own.com/StockAnalysis/ETP/US/PAO/PowerShares-Autonomic-Balanced-Growth-NFA-Global-Asset-Portfolio?w=x,canonicalised,200,text/html; charset=utf-8,PowerShares Autonomic Balanced Growth NFA Global Asset Portfolio,PowerShares Autonomic Balanced Growth NFA Global Asset Portfolio (PAO) quotes and price charts | Stock2Own.com,,http://www.stock2own.com/,allowed,,,
https://www.stock2own.com/StockAnalysis/ETP/US/IF/Indonesia-Fund?w=x,canonicalised,200,text/html; charset=utf-8,Indonesia Fund,Indonesia Fund (IF) quotes and price charts | Stock2Own.com,,http://www.stock2own.com/,allowed,,,
https://www.stock2own.com/StockAnalysis/ETP/US/ROI/WisdomTree-LargeCap-Growth-Fund?w=x,canonicalised,200,text/html; charset=utf-8,WisdomTree LargeCap Growth Fund,WisdomTree LargeCap Growth Fund (ROI) quotes and price charts | Stock2Own.com,,http://www.stock2own.com/,allowed,,,
https://www.stock2own.com/StockAnalysis/ETP/US/TMW/SPDR-Dow-Jones-Total-Market-ETF?w=x,canonicalised,200,text/html; charset=utf-8,SPDR Dow Jones Total Market ETF,SPDR Dow Jones Total Market ETF (TMW) quotes and price charts | Stock2Own.com,,http://www.stock2own.com/,allowed,,,
https://www.stock2own.com/StockAnalysis/ETP/US/GEX/VanEck-Vectors-Global-Alternative-Energy-ETF?w=x,canonicalised,200,text/html; charset=utf-8,VanEck Vectors Global Alternative Energy ETF,VanEck Vectors Global Alternative Energy ETF (GEX) quotes and price charts | Stock2Own.com,,http://www.stock2own.com/,allowed,,,
https://www.stock2own.com/StockAnalysis/StockLookup/US?searchStr=VIP.UN,canonicalised,200,text/html; charset=utf-8,Stock and Index Lookup,"Stock Lookup: search stock, index or ETF by name of symbol",,http://www.stock2own.com/,allowed,,,
https://www.stock2own.com/StockAnalysis/ETP/US/VIP.UN/Brompton-VIP-Income-Fund?w=x,found,302,text/html; charset=utf-8,,,,,allowed,https://www.stock2own.com/StockAnalysis/StockLookup/US?searchStr=VIP.UN,,
https://www.stock2own.com/StockAnalysis/StockLookup/US?searchStr=FC.UN,canonicalised,200,text/html; charset=utf-8,Stock and Index Lookup,"Stock Lookup: search stock, index or ETF by name of symbol",,http://www.stock2own.com/,allowed,,,
https://www.stock2own.com/StockAnalysis/ETP/US/FC.UN/Firm-Capital-Mortgage-Investment-Trust?w=x,found,302,text/html; charset=utf-8,,,,,allowed,https://www.stock2own.com/StockAnalysis/StockLookup/US?searchStr=FC.UN,,
https://www.stock2own.com/StockAnalysis/ETP/US/DVM/Cohen-Steers-Dividend-Majors-Fund?w=x,canonicalised,200,text/html; charset=utf-8,Cohen & Steers Dividend Majors Fund,Cohen & Steers Dividend Majors Fund (DVM) quotes and price charts | Stock2Own.com,,http://www.stock2own.com/,allowed,,,
https://www.stock2own.com/StockAnalysis/ETP/US/IWZ/iShares-Russell-3000-Growth?w=x,canonicalised,200,text/html; charset=utf-8,iShares Russell 3000 Growth,iShares Russell 3000 Growth (IWZ) quotes and price charts | Stock2Own.com,,http://www.stock2own.com/,allowed,,,
https://www.stock2own.com/StockAnalysis/ETP/US/AGF/PowerShares-DB-Agriculture-Long-ETN?w=x,canonicalised,200,text/html; charset=utf-8,PowerShares DB Agriculture Long ETN,PowerShares DB Agriculture Long ETN (AGF) quotes and price charts | Stock2Own.com,,http://www.stock2own.com/,allowed,,,
https://www.stock2own.com/StockAnalysis/StockLookup/US?searchStr=TRF.UN,canonicalised,200,text/html; charset=utf-8,Stock and Index Lookup,"Stock Lookup: search stock, index or ETF by name of symbol",,http://www.stock2own.com/,allowed,,,
https://www.stock2own.com/StockAnalysis/ETP/US/TRF.UN/First-Asset-Energy-Resource-Fund?w=x,found,302,text/html; charset=utf-8,,,,,allowed,https://www.stock2own.com/StockAnalysis/StockLookup/US?searchStr=TRF.UN,,
https://www.stock2own.com/StockAnalysis/ETP/US/PZD/PowerShares-Cleantech-Portfolio?w=x,canonicalised,200,text/html; charset=utf-8,PowerShares Cleantech Portfolio,PowerShares Cleantech Portfolio (PZD) quotes and price charts | Stock2Own.com,,http://www.stock2own.com/,allowed,,,
https://www.stock2own.com/StockAnalysis/ETP/US/NUC/Nuveen-California-Quality-Income-Municipal-Fund?w=x,canonicalised,200,text/html; charset=utf-8,Nuveen California Quality Income Municipal Fund,Nuveen California Quality Income Municipal Fund (NUC) quotes and price charts | Stock2Own.com,,http://www.stock2own.com/,allowed,,,
https://www.stock2own.com/StockAnalysis/ETP/US/DDP/PowerShares-DB-Commodity-Short-ETN?w=x,canonicalised,200,text/html; charset=utf-8,PowerShares DB Commodity Short ETN,PowerShares DB Commodity Short ETN (DDP) quotes and price charts | Stock2Own.com,,http://www.stock2own.com/,allowed,,,
https://www.stock2own.com/StockAnalysis/ETP/US/CGQRX/Columbia-Large-Growth-Quantitative-R?w=x,canonicalised,200,text/html; charset=utf-8,Columbia Large Growth Quantitative R,Columbia Large Growth Quantitative R (CGQRX) quotes and price charts | Stock2Own.com,,http://www.stock2own.com/,allowed,,,
https://www.stock2own.com/StockAnalysis/ETP/US/NUN/Nuveen-New-York-Quality-Income-Municipal-Fund?w=x,canonicalised,200,text/html; charset=utf-8,Nuveen New York Quality Income Municipal Fund,Nuveen New York Quality Income Municipal Fund (NUN) quotes and price charts | Stock2Own.com,,http://www.stock2own.com/,allowed,,,
https://www.stock2own.com/StockAnalysis/ETP/US/IWW/iShares-Russell-3000-Value?w=x,canonicalised,200,text/html; charset=utf-8,iShares Russell 3000 Value,iShares Russell 3000 Value (IWW) quotes and price charts | Stock2Own.com,,http://www.stock2own.com/,allowed,,,
https://www.stock2own.com/StockAnalysis/ETP/US/NPX/Nuveen-Insured-Premium-Income-Municipal-Fund-2?w=x,canonicalised,200,text/html; charset=utf-8,Nuveen Insured Premium Income Municipal Fund 2,Nuveen Insured Premium Income Municipal Fund 2 (NPX) quotes and price charts | Stock2Own.com,,http://www.stock2own.com/,allowed,,,
https://www.stock2own.com/StockAnalysis/ETP/US/NVC/Nuveen-California-Select-Quality-Municipal-Fund?w=x,canonicalised,200,text/html; charset=utf-8,Nuveen California Select Quality Municipal Fund,Nuveen California Select Quality Municipal Fund (NVC) quotes and price charts | Stock2Own.com,,http://www.stock2own.com/,allowed,,,
https://www.stock2own.com/StockAnalysis/ETP/US/HIH/Helios-High-Income-Fund?w=x,canonicalised,200,text/html; charset=utf-8,Helios High Income Fund,Helios High Income Fund (HIH) quotes and price charts | Stock2Own.com,,http://www.stock2own.com/,allowed,,,
https://www.stock2own.com/StockAnalysis/ETP/US/WFSSX/Wells-Fargo-Advantage-Intrns-SmCpVal-I?w=x,canonicalised,200,text/html; charset=utf-8,Wells Fargo Advantage Intrns SmCpVal I,Wells Fargo Advantage Intrns SmCpVal I (WFSSX) quotes and price charts | Stock2Own.com,,http://www.stock2own.com/,allowed,,,
https://www.stock2own.com/StockAnalysis/ETP/US/PMO/Putnam-Municipal-Opportunities-Trust?w=x,canonicalised,200,text/html; charset=utf-8,Putnam Municipal Opportunities Trust,Putnam Municipal Opportunities Trust (PMO) quotes and price charts | Stock2Own.com,,http://www.stock2own.com/,allowed,,,
https://www.stock2own.com/StockAnalysis/ETP/US/DNY/Denali-Fund-Inc?w=x,canonicalised,200,text/html; charset=utf-8,Denali Fund Inc,Denali Fund Inc (DNY) quotes and price charts | Stock2Own.com,,http://www.stock2own.com/,allowed,,,
https://www.stock2own.com/StockAnalysis/StockLookup/US?searchStr=BBO,canonicalised,200,text/html; charset=utf-8,Stock and Index Lookup,"Stock Lookup: search stock, index or ETF by name of symbol",,http://www.stock2own.com/,allowed,,,
https://www.stock2own.com/StockAnalysis/ETP/US/BBO/Big-Bank-Big-Oil-Split-Corp?w=x,found,302,text/html; charset=utf-8,,,,,allowed,https://www.stock2own.com/StockAnalysis/StockLookup/US?searchStr=BBO,,
https://www.stock2own.com/StockAnalysis/ETP/US/PKN/PowerShares-Global-Nuclear-Portfolio?w=x,canonicalised,200,text/html; charset=utf-8,PowerShares Global Nuclear Portfolio,PowerShares Global Nuclear Portfolio (PKN) quotes and price charts | Stock2Own.com,,http://www.stock2own.com/,allowed,,,
https://www.stock2own.com/StockAnalysis/StockLookup/US?searchStr=SBC,canonicalised,200,text/html; charset=utf-8,Stock and Index Lookup,"Stock Lookup: search stock, index or ETF by name of symbol",,http://www.stock2own.com/,allowed,,,
https://www.stock2own.com/StockAnalysis/ETP/US/SBC/Brompton-Split-Banc-Corp?w=x,found,302,text/html; charset=utf-8,,,,,allowed,https://www.stock2own.com/StockAnalysis/StockLookup/US?searchStr=SBC,,
https://www.stock2own.com/StockAnalysis/ETP/US/FDV/First-Trust-DB-Strategic-Value-ETF?w=x,canonicalised,200,text/html; charset=utf-8,First Trust DB Strategic Value ETF,First Trust DB Strategic Value ETF (FDV) quotes and price charts | Stock2Own.com,,http://www.stock2own.com/,allowed,,,
https://www.stock2own.com/StockAnalysis/ETP/US/ATVYF/ACTIVENERGY-INC-FD?w=x,canonicalised,200,text/html; charset=utf-8,ACTIVENERGY INC FD,ACTIVENERGY INC FD (ATVYF) quotes and price charts | Stock2Own.com,,http://www.stock2own.com/,allowed,,,
https://www.stock2own.com/StockAnalysis/ETP/US/PSY/BlackRock-Preferred-Income-Strategies-Fund-Inc?w=x,canonicalised,200,text/html; charset=utf-8,BlackRock Preferred Income Strategies Fund Inc.,BlackRock Preferred Income Strategies Fund Inc. (PSY) quotes and price charts | Stock2Own.com,,http://www.stock2own.com/,allowed,,,
https://www.stock2own.com/StockAnalysis/ETP/US/JYF/WisdomTree-Dreyfus-Japanese-Yen-Fund?w=x,canonicalised,200,text/html; charset=utf-8,WisdomTree Dreyfus Japanese Yen Fund,WisdomTree Dreyfus Japanese Yen Fund (JYF) quotes and price charts | Stock2Own.com,,http://www.stock2own.com/,allowed,,,
https://www.stock2own.com/StockAnalysis/ETP/US/TF/Thai-Capital-Fund?w=x,canonicalised,200,text/html; charset=utf-8,Thai Capital Fund,Thai Capital Fund (TF) quotes and price charts | Stock2Own.com,,http://www.stock2own.com/,allowed,,,
https://www.stock2own.com/StockAnalysis/ETP/US/DPO/Dow-30-Enhanced-Premium-Income-Fund-Inc?w=x,canonicalised,200,text/html; charset=utf-8,Dow 30 Enhanced Premium & Income Fund Inc,Dow 30 Enhanced Premium & Income Fund Inc (DPO) quotes and price charts | Stock2Own.com,,http://www.stock2own.com/,allowed,,,
https://www.stock2own.com/StockAnalysis/ETP/US/SLA/American-Select-Portfolio?w=x,canonicalised,200,text/html; charset=utf-8,American Select Portfolio,American Select Portfolio (SLA) quotes and price charts | Stock2Own.com,,http://www.stock2own.com/,allowed,,,
https://www.stock2own.com/StockAnalysis/ETP/US/BHY/BlackRock-High-Yield-Trust?w=x,canonicalised,200,text/html; charset=utf-8,BlackRock High Yield Trust,BlackRock High Yield Trust (BHY) quotes and price charts | Stock2Own.com,,http://www.stock2own.com/,allowed,,,
https://www.stock2own.com/StockAnalysis/ETP/US/PXN/PowerShares-Lux-Nanotech-Portfolio?w=x,canonicalised,200,text/html; charset=utf-8,PowerShares Lux Nanotech Portfolio,PowerShares Lux Nanotech Portfolio (PXN) quotes and price charts | Stock2Own.com,,http://www.stock2own.com/,allowed,,,
https://www.stock2own.com/StockAnalysis/ETP/US/DYY/PowerShares-DB-Commodity-Double-Long-ETN?w=x,canonicalised,200,text/html; charset=utf-8,PowerShares DB Commodity Double Long ETN,PowerShares DB Commodity Double Long ETN (DYY) quotes and price charts | Stock2Own.com,,http://www.stock2own.com/,allowed,,,
