url,crawl_status,status_code,content_type,h1,page_title,meta_description,canonical_tag,robots_txt,redirect_url,meta_robots,x_robots_tag
https://www.stock2own.com/StockAnalysis/Stock/US/HSFIX/HSBC-Frontier-Markets-I?w=x,canonicalised,200,text/html; charset=utf-8,HSBC Frontier Markets I,"HSBC Frontier Markets I (HSFIX) quotes, price charts | Stock2Own.com",,http://www.stock2own.com/,allowed,,,
https://www.stock2own.com/StockAnalysis/Stock/US/HBCYF/HSBC-HOLDINGS-PLC-ORD-USD0-50-UK-REG?w=x,canonicalised,200,text/html; charset=utf-8,HSBC HOLDINGS PLC ORD USD0.50(UK REG),"HSBC HOLDINGS PLC ORD USD0.50(UK REG) (HBCYF) quotes, price charts | Stock2Own.com",,http://www.stock2own.com/,allowed,,,
https://www.stock2own.com/StockAnalysis/Stock/US/CSBC/Citizens-South-Banking-Corporation?w=x,canonicalised,200,text/html; charset=utf-8,Citizens South Banking Corporation,"Citizens South Banking Corporation (CSBC) quotes, price charts | Stock2Own.com",,http://www.stock2own.com/,allowed,,,
https://www.stock2own.com/StockAnalysis/Stock/US/OSBC/Old-Second-Bancorporation-Inc?w=x,canonicalised,200,text/html; charset=utf-8,Old Second Bancorporation Inc,"Old Second Bancorporation Inc (OSBC) quotes, price charts | Stock2Own.com",,http://www.stock2own.com/,allowed,,,
https://www.stock2own.com/StockAnalysis/Stock/US/PSBC/Pacific-State-Bancorp?w=x,canonicalised,200,text/html; charset=utf-8,Pacific State Bancorp,"Pacific State Bancorp (PSBC) quotes, price charts | Stock2Own.com",,http://www.stock2own.com/,allowed,,,
https://www.stock2own.com/StockAnalysis/Stock/US/_HSBC_/HSBC-Holdings-plc-HSEB?w=x,canonicalised,200,text/html; charset=utf-8,HSBC Holdings plc [HSEB],"HSBC Holdings plc [HSEB] (_HSBC_) quotes, price charts | Stock2Own.com",,http://www.stock2own.com/,allowed,,,
https://www.stock2own.com/StockAnalysis/Stock/US/WSBC/Wesbanco-Inc-WSBC?w=x,canonicalised,200,text/html; charset=utf-8,Wesbanco Inc [WSBC],"Wesbanco Inc [WSBC] (WSBC) quotes, price charts | Stock2Own.com",,http://www.stock2own.com/,allowed,,,
https://www.stock2own.com/StockAnalysis/Stock/US/_HSEA_/HSBC-Holdings-plc?w=x,canonicalised,200,text/html; charset=utf-8,HSBC Holdings plc,"HSBC Holdings plc (_HSEA_) quotes, price charts | Stock2Own.com",,http://www.stock2own.com/,allowed,,,
https://www.stock2own.com/StockAnalysis/Stock/US/NSBC/North-State-Bancorp?w=x,canonicalised,200,text/html; charset=utf-8,North State Bancorp,"North State Bancorp (NSBC) quotes, price charts | Stock2Own.com",,http://www.stock2own.com/,allowed,,,
https://www.stock2own.com/StockAnalysis/Stock/US/HBC/HSBC-Holdings-plc-ADR?w=x,canonicalised,200,text/html; charset=utf-8,HSBC Holdings plc (ADR),"HSBC Holdings plc (ADR) (HBC) quotes, price charts | Stock2Own.com",,http://www.stock2own.com/,allowed,,,
https://www.stock2own.com/StockAnalysis/Stock/US/GSBC/Great-Southern-Bancorp-Inc?w=x,canonicalised,200,text/html; charset=utf-8,Great Southern Bancorp Inc,"Great Southern Bancorp Inc (GSBC) quotes, price charts | Stock2Own.com",,http://www.stock2own.com/,allowed,,,
https://www.stock2own.com/StockAnalysis/Stock/US/IWFSF/Infowave-Software-Inc?w=x,canonicalised,200,text/html; charset=utf-8,Infowave Software Inc,"Infowave Software Inc (IWFSF) quotes, price charts | Stock2Own.com",,http://www.stock2own.com/,allowed,,,
https://www.stock2own.com/StockAnalysis/Stock/US/WFSC/Weststar-Financial-Services-Corp?w=x,canonicalised,200,text/html; charset=utf-8,Weststar Financial Services Corp,"Weststar Financial Services Corp (WFSC) quotes, price charts | Stock2Own.com",,http://www.stock2own.com/,allowed,,,
https://www.stock2own.com/StockAnalysis/Stock/US/SBCBX/QS-Defensive-Growth-B?w=x,canonicalised,200,text/html; charset=utf-8,QS Defensive Growth B,"QS Defensive Growth B (SBCBX) quotes, price charts | Stock2Own.com",,http://www.stock2own.com/,allowed,,,
https://www.stock2own.com/StockAnalysis/Stock/US/WFSV/WORLDWIDE-FOOD-SVCS?w=x,canonicalised,200,text/html; charset=utf-8,WORLDWIDE FOOD SVCS.,"WORLDWIDE FOOD SVCS. (WFSV) quotes, price charts | Stock2Own.com",,http://www.stock2own.com/,allowed,,,
https://www.stock2own.com/StockAnalysis/Stock/US/MWFS/Mid-Wisconsin-Financial-Services-Inc?w=x,canonicalised,200,text/html; charset=utf-8,Mid-Wisconsin Financial Services Inc,"Mid-Wisconsin Financial Services Inc (MWFS) quotes, price charts | Stock2Own.com",,http://www.stock2own.com/,allowed,,,
https://www.stock2own.com/StockAnalysis/Stock/US/WWFS/WEST-WIND-FINL-COM-NPV?w=x,canonicalised,200,text/html; charset=utf-8,WEST WIND FINL COM NPV,"WEST WIND FINL COM NPV (WWFS) quotes, price charts | Stock2Own.com",,http://www.stock2own.com/,allowed,,,
https://www.stock2own.com/StockAnalysis/Stock/US/WFEMF/WOULFE-MINING?w=x,canonicalised,200,text/html; charset=utf-8,WOULFE MINING,"WOULFE MINING (WFEMF) quotes, price charts | Stock2Own.com",,http://www.stock2own.com/,allowed,,,
https://www.stock2own.com/StockAnalysis/Stock/US/WFSTF/WESTERN-FOREST-PRO-COM-STK-NPV?w=x,canonicalised,200,text/html; charset=utf-8,WESTERN FOREST PRO COM STK NPV,"WESTERN FOREST PRO COM STK NPV (WFSTF) quotes, price charts | Stock2Own.com",,http://www.stock2own.com/,allowed,,,
https://www.stock2own.com/StockAnalysis/Stock/US/NCLIP/NORTH-COAST-LFE-INS10PR-A?w=x,canonicalised,200,text/html; charset=utf-8,NORTH COAST LFE INS10PR A,"NORTH COAST LFE INS10PR A (NCLIP) quotes, price charts | Stock2Own.com",,http://www.stock2own.com/,allowed,,,
https://www.stock2own.com/StockAnalysis/Stock/US/SLFEF/SUN-LIFE-CORP-COM-NPV?w=x,canonicalised,200,text/html; charset=utf-8,SUN LIFE CORP COM NPV,"SUN LIFE CORP COM NPV (SLFEF) quotes, price charts | Stock2Own.com",,http://www.stock2own.com/,allowed,,,
https://www.stock2own.com/StockAnalysis/Stock/US/GLFE/Gulf-United-Energy-Inc?w=x,canonicalised,200,text/html; charset=utf-8,Gulf United Energy Inc,"Gulf United Energy Inc (GLFE) quotes, price charts | Stock2Own.com",,http://www.stock2own.com/,allowed,,,
https://www.stock2own.com/StockAnalysis/StockLookup/US?searchStr=SLS,canonicalised,200,text/html; charset=utf-8,Stock and Index Lookup,"Stock Lookup: search stock, index or ETF by name of symbol",,http://www.stock2own.com/,allowed,,,
https://www.stock2own.com/StockAnalysis/ETP/US/SLS/SL-Split-Corp?w=x,found,302,text/html; charset=utf-8,,,,,allowed,https://www.stock2own.com/StockAnalysis/StockLookup/US?searchStr=SLS,,
https://www.stock2own.com/StockAnalysis/Stock/US/_PLFE_/Presidential-Life-LLC?w=x,canonicalised,200,text/html; charset=utf-8,Presidential Life LLC,"Presidential Life LLC (_PLFE_) quotes, price charts | Stock2Own.com",,http://www.stock2own.com/,allowed,,,
https://www.stock2own.com/StockAnalysis/ETF/US/LFEQ/VanEck-Vectors-Long-Flat-Trend-ETF?w=x,canonicalised,200,text/html; charset=utf-8,VanEck Vectors Long/Flat Trend ETF,VanEck Vectors Long/Flat Trend ETF (LFEQ) quotes and price charts | Stock2Own.com,,http://www.stock2own.com/,allowed,,,
https://www.stock2own.com/StockAnalysis/Stock/US/LFEFY/Arturus-Capital-Ltd-ADR?w=x,canonicalised,200,text/html; charset=utf-8,Arturus Capital Ltd (ADR),"Arturus Capital Ltd (ADR) (LFEFY) quotes, price charts | Stock2Own.com",,http://www.stock2own.com/,allowed,,,
https://www.stock2own.com/StockAnalysis/Stock/US/ALFE/CNK-Global-Inc?w=x,canonicalised,200,text/html; charset=utf-8,CNK Global Inc,"CNK Global Inc (ALFE) quotes, price charts | Stock2Own.com",,http://www.stock2own.com/,allowed,,,
https://www.stock2own.com/StockAnalysis/Stock/US/LFEEF/LEE-FEEDMILL-THB1-NVDR?w=x,canonicalised,200,text/html; charset=utf-8,LEE FEEDMILL THB1(NVDR),"LEE FEEDMILL THB1(NVDR) (LFEEF) quotes, price charts | Stock2Own.com",,http://www.stock2own.com/,allowed,,,
https://www.stock2own.com/StockAnalysis/StockLookup/US?searchStr=PDV,canonicalised,200,text/html; charset=utf-8,Stock and Index Lookup,"Stock Lookup: search stock, index or ETF by name of symbol",,http://www.stock2own.com/,allowed,,,
https://www.stock2own.com/StockAnalysis/ETP/US/PDV/Prime-Dividend-Corp?w=x,found,302,text/html; charset=utf-8,,,,,allowed,https://www.stock2own.com/StockAnalysis/StockLookup/US?searchStr=PDV,,
https://www.stock2own.com/StockAnalysis/Stock/US/MYTHY/MYTILINEOS-UNSP-ADR-EACH-REPR-1-ORD?w=x,canonicalised,200,text/html; charset=utf-8,MYTILINEOS UNSP ADR EACH REPR 1 ORD,"MYTILINEOS UNSP ADR EACH REPR 1 ORD (MYTHY) quotes, price charts | Stock2Own.com",,http://www.stock2own.com/,allowed,,,
https://www.stock2own.com/StockAnalysis/Stock/US/RLBS/Reliance-Bancshares-Inc?w=x,canonicalised,200,text/html; charset=utf-8,Reliance Bancshares Inc,"Reliance Bancshares Inc (RLBS) quotes, price charts | Stock2Own.com",,http://www.stock2own.com/,allowed,,,
https://www.stock2own.com/StockAnalysis/Stock/US/GLBS/Globus-Maritime-Ltd?w=x,canonicalised,200,text/html; charset=utf-8,Globus Maritime Ltd,"Globus Maritime Ltd (GLBS) quotes, price charts | Stock2Own.com",,http://www.stock2own.com/,allowed,,,
https://www.stock2own.com/StockAnalysis/Stock/US/LFEX/LUCKY-FRIDAY-EXTEN-COM-NPV?w=x,canonicalised,200,text/html; charset=utf-8,LUCKY FRIDAY EXTEN COM NPV,"LUCKY FRIDAY EXTEN COM NPV (LFEX) quotes, price charts | Stock2Own.com",,http://www.stock2own.com/,allowed,,,
https://www.stock2own.com/StockAnalysis/ETF/US/_DLBS_/iPath-US-Treasury-Long-Bond-Bear-ETN?w=x,canonicalised,200,text/html; charset=utf-8,iPath US Treasury Long Bond Bear ETN,iPath US Treasury Long Bond Bear ETN (_DLBS_) quotes and price charts | Stock2Own.com,,http://www.stock2own.com/,allowed,,,
https://www.stock2own.com/StockAnalysis/Stock/US/LBSV/Liberty-Silver-Corp?w=x,canonicalised,200,text/html; charset=utf-8,Liberty Silver Corp,"Liberty Silver Corp (LBSV) quotes, price charts | Stock2Own.com",,http://www.stock2own.com/,allowed,,,
https://www.stock2own.com/StockAnalysis/StockLookup/US?searchStr=FTN,canonicalised,200,text/html; charset=utf-8,Stock and Index Lookup,"Stock Lookup: search stock, index or ETF by name of symbol",,http://www.stock2own.com/,allowed,,,
https://www.stock2own.com/StockAnalysis/ETP/US/FTN/Financial-15-Split-Corp?w=x,found,302,text/html; charset=utf-8,,,,,allowed,https://www.stock2own.com/StockAnalysis/StockLookup/US?searchStr=FTN,,
https://www.stock2own.com/InvestingForum/StockMarketTrading/S2ONewsletter?pn=1,canonicalised,200,text/html; charset=utf-8,S2O Investing Forum: Stock2own Newsletter,Stock2own Newsletter - S2O Investing Forum.,,http://www.stock2own.com/,allowed,,,
https://www.stock2own.com/StockAnalysis/Stock/US/LBSR/Liberty-Star-Uranium-x26-Metals-Corp?w=x,canonicalised,200,text/html; charset=utf-8,Liberty Star Uranium x26 Metals Corp.,"Liberty Star Uranium x26 Metals Corp. (LBSR) quotes, price charts | Stock2Own.com",,http://www.stock2own.com/,allowed,,,
https://www.stock2own.com/StockAnalysis/Stock/US/CLBS/Caladrius-Biosciences-Inc?w=x,canonicalised,200,text/html; charset=utf-8,Caladrius Biosciences Inc,"Caladrius Biosciences Inc (CLBS) quotes, price charts | Stock2Own.com",,http://www.stock2own.com/,allowed,,,
https://www.stock2own.com/StockAnalysis/Stock/US/AFFN/AFFINITY-NETWORKS-COM-USD0-01?w=x,canonicalised,200,text/html; charset=utf-8,AFFINITY NETWORKS COM USD0.01,"AFFINITY NETWORKS COM USD0.01 (AFFN) quotes, price charts | Stock2Own.com",,http://www.stock2own.com/,allowed,,,
https://www.stock2own.com/StockAnalysis/Stock/US/FFNGY/FUFENG-GROUP-LTD-ADR-EACH-REP-20-ORD?w=x,canonicalised,200,text/html; charset=utf-8,FUFENG GROUP LTD ADR EACH REP 20 ORD,"FUFENG GROUP LTD ADR EACH REP 20 ORD (FFNGY) quotes, price charts | Stock2Own.com",,http://www.stock2own.com/,allowed,,,
https://www.stock2own.com/StockAnalysis/Stock/US/DFFN/Diffusion-Pharmaceuticals-Inc?w=x,canonicalised,200,text/html; charset=utf-8,Diffusion Pharmaceuticals Inc,"Diffusion Pharmaceuticals Inc (DFFN) quotes, price charts | Stock2Own.com",,http://www.stock2own.com/,allowed,,,
https://www.stock2own.com/StockAnalysis/Stock/US/FFN/null-FFN?w=x,canonicalised,200,text/html; charset=utf-8,null [FFN],"null [FFN] (FFN) quotes, price charts | Stock2Own.com",,http://www.stock2own.com/,allowed,,,
https://www.stock2own.com/StockAnalysis/Stock/US/FFNTQ/FriendFinder-Networks-Inc?w=x,canonicalised,200,text/html; charset=utf-8,FriendFinder Networks Inc,"FriendFinder Networks Inc (FFNTQ) quotes, price charts | Stock2Own.com",,http://www.stock2own.com/,allowed,,,
https://www.stock2own.com/StockAnalysis/Stock/US/SCFHF/SCHAFFNER-HLDG-AG-CHF32-50-REGD?w=x,canonicalised,200,text/html; charset=utf-8,SCHAFFNER HLDG AG CHF32.50 (REGD),"SCHAFFNER HLDG AG CHF32.50 (REGD) (SCFHF) quotes, price charts | Stock2Own.com",,http://www.stock2own.com/,allowed,,,
https://www.stock2own.com/StockAnalysis/Stock/US/_FFNM_/First-Federal-of-Nrthrn-Michgn-Bancp-Inc?w=x,canonicalised,200,text/html; charset=utf-8,First Federal of Nrthrn Michgn Bancp Inc,"First Federal of Nrthrn Michgn Bancp Inc (_FFNM_) quotes, price charts | Stock2Own.com",,http://www.stock2own.com/,allowed,,,
https://www.stock2own.com/StockAnalysis/Stock/US/DLBS/iPath-US-Treasury-Long-Bond-Bear-ETN?w=x,canonicalised,200,text/html; charset=utf-8,iPath US Treasury Long Bond Bear ETN,"iPath US Treasury Long Bond Bear ETN (DLBS) quotes, price charts | Stock2Own.com",,http://www.stock2own.com/,allowed,,,
https://www.stock2own.com/StockAnalysis/Stock/US/FFNOX/Fidelity-Four-in-One-Index-Fund?w=x,canonicalised,200,text/html; charset=utf-8,Fidelity Four-in-One Index Fund,"Fidelity Four-in-One Index Fund (FFNOX) quotes, price charts | Stock2Own.com",,http://www.stock2own.com/,allowed,,,
https://www.stock2own.com/StockAnalysis/Stock/US/TUFF/Tuffnell-Ltd?w=x,canonicalised,200,text/html; charset=utf-8,Tuffnell Ltd,"Tuffnell Ltd (TUFF) quotes, price charts | Stock2Own.com",,http://www.stock2own.com/,allowed,,,
https://www.stock2own.com/StockAnalysis/Stock/US/CFFN/Capitol-Federal-Financial?w=x,canonicalised,200,text/html; charset=utf-8,Capitol Federal Financial,"Capitol Federal Financial (CFFN) quotes, price charts | Stock2Own.com",,http://www.stock2own.com/,allowed,,,
https://www.stock2own.com/Stock_Profile_RUE_072611.aspx,found,302,text/html; charset=utf-8,,,,,allowed,https://www.stock2own.com/,,
http://www.stock2own.com/Stock_Profile_RUE_072611.aspx,moved permanently,301,text/html; charset=UTF-8,,,,,allowed,https://www.stock2own.com/Stock_Profile_RUE_072611.aspx,,
https://www.stock2own.com/StockAnalysis/Stock/US/SXCP/SunCoke-Energy-Partners-L-P,canonicalised,200,text/html; charset=utf-8,SunCoke Energy Partners LP,"SunCoke Energy Partners LP (_SXCP_) quotes, price charts | Stock2Own.com",,http://www.stock2own.com/,allowed,,,
http://www.stock2own.com/StockAnalysis/Stock/US/SXCP/SunCoke-Energy-Partners-L-P,moved permanently,301,text/html; charset=UTF-8,,,,,allowed,https://www.stock2own.com/StockAnalysis/Stock/US/SXCP/SunCoke-Energy-Partners-L-P,,
https://www.stock2own.com/StockAnalysis/Stock/US/FFNW/First-Financial-Northwest-Inc?w=x,canonicalised,200,text/html; charset=utf-8,First Financial Northwest Inc,"First Financial Northwest Inc (FFNW) quotes, price charts | Stock2Own.com",,http://www.stock2own.com/,allowed,,,
https://www.stock2own.com/StockAnalysis/Stock/US/MFA/MFA-Financial-Inc,canonicalised,200,text/html; charset=utf-8,MFA Financial Inc [MFA],"MFA Financial Inc [MFA] (MFA) quotes, price charts | Stock2Own.com",,http://www.stock2own.com/,allowed,,,
http://www.stock2own.com/StockAnalysis/Stock/US/MFA/MFA-Financial-Inc,moved permanently,301,text/html; charset=UTF-8,,,,,allowed,https://www.stock2own.com/StockAnalysis/Stock/US/MFA/MFA-Financial-Inc,,
https://www.stock2own.com/StockAnalysis/Stock/US/SDLP/Seadrill-Partners-LLC,canonicalised,200,text/html; charset=utf-8,Seadrill Partners LLC,"Seadrill Partners LLC (_SDLP_) quotes, price charts | Stock2Own.com",,http://www.stock2own.com/,allowed,,,
http://www.stock2own.com/StockAnalysis/Stock/US/SDLP/Seadrill-Partners-LLC,moved permanently,301,text/html; charset=UTF-8,,,,,allowed,https://www.stock2own.com/StockAnalysis/Stock/US/SDLP/Seadrill-Partners-LLC,,
https://www.stock2own.com/StockAnalysis/Stock/US/NAT/Nordic-American-Tankers-Limited,canonicalised,200,text/html; charset=utf-8,Nordic American Tankers Ltd,"Nordic American Tankers Ltd (NAT) quotes, price charts | Stock2Own.com",,http://www.stock2own.com/,allowed,,,
http://www.stock2own.com/StockAnalysis/Stock/US/NAT/Nordic-American-Tankers-Limited,moved permanently,301,text/html; charset=UTF-8,,,,,allowed,https://www.stock2own.com/StockAnalysis/Stock/US/NAT/Nordic-American-Tankers-Limited,,
https://www.stock2own.com/StockAnalysis/Stock/US/MMLP/Martin-Midstream-Partners-L-P,canonicalised,200,text/html; charset=utf-8,Martin Midstream Partners LP,"Martin Midstream Partners LP (MMLP) quotes, price charts | Stock2Own.com",,http://www.stock2own.com/,allowed,,,
http://www.stock2own.com/StockAnalysis/Stock/US/MMLP/Martin-Midstream-Partners-L-P,moved permanently,301,text/html; charset=UTF-8,,,,,allowed,https://www.stock2own.com/StockAnalysis/Stock/US/MMLP/Martin-Midstream-Partners-L-P,,
https://www.stock2own.com/StockAnalysis/Stock/US/NRZ/New-Residential-Investment-Corp,canonicalised,200,text/html; charset=utf-8,New Residential Investment Corp,"New Residential Investment Corp (NRZ) quotes, price charts | Stock2Own.com",,http://www.stock2own.com/,allowed,,,
http://www.stock2own.com/StockAnalysis/Stock/US/NRZ/New-Residential-Investment-Corp,moved permanently,301,text/html; charset=UTF-8,,,,,allowed,https://www.stock2own.com/StockAnalysis/Stock/US/NRZ/New-Residential-Investment-Corp,,
https://www.stock2own.com/StockAnalysis/Stock/US/GMLP/Golar-LNG-Partners-LP,canonicalised,200,text/html; charset=utf-8,Golar LNG Partners LP,"Golar LNG Partners LP (_GMLP_) quotes, price charts | Stock2Own.com",,http://www.stock2own.com/,allowed,,,
http://www.stock2own.com/StockAnalysis/Stock/US/GMLP/Golar-LNG-Partners-LP,moved permanently,301,text/html; charset=UTF-8,,,,,allowed,https://www.stock2own.com/StockAnalysis/Stock/US/GMLP/Golar-LNG-Partners-LP,,
https://www.stock2own.com/StockAnalysis/Stock/US/NYMT/New-York-Mortgage-Trust-Inc,canonicalised,200,text/html; charset=utf-8,New York Mortgage Trust Inc [NYMT],"New York Mortgage Trust Inc [NYMT] (NYMT) quotes, price charts | Stock2Own.com",,http://www.stock2own.com/,allowed,,,
http://www.stock2own.com/StockAnalysis/Stock/US/NYMT/New-York-Mortgage-Trust-Inc,moved permanently,301,text/html; charset=UTF-8,,,,,allowed,https://www.stock2own.com/StockAnalysis/Stock/US/NYMT/New-York-Mortgage-Trust-Inc,,
https://www.stock2own.com/InvestingForum/StockIntrinsicValue/S2ONewsletter/2280?pn=2&rpn=1,canonicalised,200,text/html; charset=utf-8,S2O Investing Forum: Stock2own Newsletter,Stock2own Newsletter - S2O Investing Forum,,http://www.stock2own.com/,allowed,,,
https://www.stock2own.com/StockAnalysis/Stock/US/CMRE/Costamare-Inc,canonicalised,200,text/html; charset=utf-8,Costamare Inc,"Costamare Inc (CMRE) quotes, price charts | Stock2Own.com",,http://www.stock2own.com/,allowed,,,
http://www.stock2own.com/StockAnalysis/Stock/US/CMRE/Costamare-Inc,moved permanently,301,text/html; charset=UTF-8,,,,,allowed,https://www.stock2own.com/StockAnalysis/Stock/US/CMRE/Costamare-Inc,,
https://www.stock2own.com/StockAnalysis/Stock/US/GAIN/Gladstone-Investment-Corporation,canonicalised,200,text/html; charset=utf-8,Gladstone Investment Corp,"Gladstone Investment Corp (GAIN) quotes, price charts | Stock2Own.com",,http://www.stock2own.com/,allowed,,,
http://www.stock2own.com/StockAnalysis/Stock/US/GAIN/Gladstone-Investment-Corporation,moved permanently,301,text/html; charset=UTF-8,,,,,allowed,https://www.stock2own.com/StockAnalysis/Stock/US/GAIN/Gladstone-Investment-Corporation,,
https://www.stock2own.com/InvestingForum/StockIntrinsicValue/Reading/1548?pn=2&rpn=1,canonicalised,200,text/html; charset=utf-8,S2O Investing Forum: Recommended Readings,Recommended Readings - S2O Investing Forum,,http://www.stock2own.com/,allowed,,,
https://www.stock2own.com/StockAnalysis/Stock/US/DMLP/Dorchester-Minerals-L-P,canonicalised,200,text/html; charset=utf-8,Dorchester Minerals LP,"Dorchester Minerals LP (DMLP) quotes, price charts | Stock2Own.com",,http://www.stock2own.com/,allowed,,,
http://www.stock2own.com/StockAnalysis/Stock/US/DMLP/Dorchester-Minerals-L-P,moved permanently,301,text/html; charset=UTF-8,,,,,allowed,https://www.stock2own.com/StockAnalysis/Stock/US/DMLP/Dorchester-Minerals-L-P,,
https://www.stock2own.com/InvestingForum/StockMarketTrading/Reading?pn=1,canonicalised,200,text/html; charset=utf-8,S2O Investing Forum: Recommended Readings,Recommended Readings - S2O Investing Forum.,,http://www.stock2own.com/,allowed,,,
https://www.stock2own.com/StockAnalysis/Stock/US/CVI/CVR-Energy,canonicalised,200,text/html; charset=utf-8,CVR Energy Inc,"CVR Energy Inc (CVI) quotes, price charts | Stock2Own.com",,http://www.stock2own.com/,allowed,,,
http://www.stock2own.com/StockAnalysis/Stock/US/CVI/CVR-Energy,moved permanently,301,text/html; charset=UTF-8,,,,,allowed,https://www.stock2own.com/StockAnalysis/Stock/US/CVI/CVR-Energy,,
https://www.stock2own.com/InvestingForum/StockIntrinsicValue/Reading/109/Book-Suggestion?rpn=2,canonicalised,200,text/html; charset=utf-8,S2O Investing Forum: Recommended Readings,Recommended Readings. Book Suggestion - S2O Investing Forum,,http://www.stock2own.com/,allowed,,,
https://www.stock2own.com/About_Products.aspx,found,302,text/html; charset=utf-8,,,,,allowed,https://www.stock2own.com/,,
http://www.stock2own.com/About_Products.aspx,moved permanently,301,text/html; charset=UTF-8,,,,,allowed,https://www.stock2own.com/About_Products.aspx,,
https://www.stock2own.com/InvestingForum/StockIntrinsicValue/Reading/69/The-Little-Book-of-Value-Investing-by-Christopher-H-Browne?rpn=2,canonicalised,200,text/html; charset=utf-8,S2O Investing Forum: Recommended Readings,Recommended Readings. The Little Book of Value Investing by Christopher H Browne - S2O Investing Forum,,http://www.stock2own.com/,allowed,,,
https://www.stock2own.com/InvestingForum/StockIntrinsicValue/Reading/854/PAYBACK-TIME?rpn=2,canonicalised,200,text/html; charset=utf-8,S2O Investing Forum: Recommended Readings,Recommended Readings. PAYBACK TIME - S2O Investing Forum,,http://www.stock2own.com/,allowed,,,
https://www.stock2own.com/InvestingForum/StockMarketTrading/Questions?pn=1,canonicalised,200,text/html; charset=utf-8,S2O Investing Forum: Questions,Questions - S2O Investing Forum.,,http://www.stock2own.com/,allowed,,,
https://www.stock2own.com/InvestingForum/StockIntrinsicValue/Questions/5011/I-read-PT-Rule-1-several-times-and-finally-got-back-into-stocks?rpn=3,canonicalised,200,text/html; charset=utf-8,S2O Investing Forum: Questions,Questions. I read PT Rule 1 several times and finally got back into stocks - S2O Investing Forum,,http://www.stock2own.com/,allowed,,,
https://www.stock2own.com/InvestingForum/StockIntrinsicValue/Questions/3980/I-am-looking-at-the-analysis-for-MASC-It-has-no-LT-debt-per-the?rpn=3,canonicalised,200,text/html; charset=utf-8,S2O Investing Forum: Questions,Questions. I am looking at the analysis for MASC It has no LT debt per the - S2O Investing Forum,,http://www.stock2own.com/,allowed,,,
https://www.stock2own.com/InvestingForum/StockMarketTrading/Questions?pn=4,canonicalised,200,text/html; charset=utf-8,S2O Investing Forum: Questions,Questions - S2O Investing Forum.,,http://www.stock2own.com/,allowed,,,
https://www.stock2own.com/InvestingForum/StockIntrinsicValue/Questions/5032/when-you-say-return-on-sales-are-you-reffering-to-net?rpn=3,canonicalised,200,text/html; charset=utf-8,S2O Investing Forum: Questions,Questions. when you say return on sales are you reffering to net - S2O Investing Forum,,http://www.stock2own.com/,allowed,,,
https://www.stock2own.com/InvestingForum/StockIntrinsicValue/Questions/3982/Why-the-difference-in-Instrinsic-Value-from-the-Graham-Number-and?rpn=3,canonicalised,200,text/html; charset=utf-8,S2O Investing Forum: Questions,Questions. Why the difference in Instrinsic Value from the Graham Number and - S2O Investing Forum,,http://www.stock2own.com/,allowed,,,
https://www.stock2own.com/InvestingForum/StockIntrinsicValue/Questions/4992/Hello-together?rpn=3,canonicalised,200,text/html; charset=utf-8,S2O Investing Forum: Questions,Questions - S2O Investing Forum,,http://www.stock2own.com/,allowed,,,
https://www.stock2own.com/InvestingForum/StockIntrinsicValue/Questions/2967/The-older-format-of-Stock2Own-allowed-me-to-change-the-EPS-growth?rpn=3,canonicalised,200,text/html; charset=utf-8,S2O Investing Forum: Questions,Questions. The older format of Stock2Own allowed me to change the EPS growth - S2O Investing Forum,,http://www.stock2own.com/,allowed,,,
https://www.stock2own.com/InvestingForum/StockIntrinsicValue/Questions/5010/I-need-guidance-on-which-TIs-to-follow-more-closely-I-have-my?rpn=3,canonicalised,200,text/html; charset=utf-8,S2O Investing Forum: Questions,Questions. I need guidance on which TIs to follow more closely I have my - S2O Investing Forum,,http://www.stock2own.com/,allowed,,,
https://www.stock2own.com/InvestingForum/StockIntrinsicValue/Questions/2895/Why-is-the-latest-data-a-year-behind?rpn=3,canonicalised,200,text/html; charset=utf-8,S2O Investing Forum: Questions,Questions. Why is the latest data a year behind - S2O Investing Forum,,http://www.stock2own.com/,allowed,,,
https://www.stock2own.com/InvestingForum/StockIntrinsicValue/Questions/5007/Hello-I-read-through-Phil-Town-s-book-and-understand-the-procedure?rpn=3,canonicalised,200,text/html; charset=utf-8,S2O Investing Forum: Questions,Questions. Hello I read through Phil Town s book and understand the procedure - S2O Investing Forum,,http://www.stock2own.com/,allowed,,,
https://www.stock2own.com/InvestingForum/StockIntrinsicValue/Questions/5016/Let-s-list-the-brokerage-firms-everyone-uses-and-a-short-reason-why?rpn=3,canonicalised,200,text/html; charset=utf-8,S2O Investing Forum: Questions,Questions. Let s list the brokerage firms everyone uses and a short reason why - S2O Investing Forum,,http://www.stock2own.com/,allowed,,,
