url,crawl_status,status_code,content_type,h1,page_title,meta_description,canonical_tag,robots_txt,redirect_url,meta_robots,x_robots_tag
https://www.stock2own.com/,canonicalised,200,text/html; charset=utf-8,,"Stock Analysis, Value Price, Price Charts, AI Signals | Stock2Own.com",,http://www.stock2own.com/,allowed,,,
https://www.stock2own.com/StockMarket/News,canonicalised,200,text/html; charset=utf-8,Stock Market: News,"Stock Market News: MarketWatch, Wall Street Journal, Benzinga and more | stock2own.com",,http://www.stock2own.com/,allowed,,,
https://www.stock2own.com/About/Tutorials,canonicalised,200,text/html; charset=utf-8,Stock2Own Tutorials,Stock2Own Video Tutorials: learn how to analyze stocks,,http://www.stock2own.com/,allowed,,,
https://www.stock2own.com/StockMarket/Gauges/Dashboard,canonicalised,200,text/html; charset=utf-8,Stock Market Gauges: Dashboard,"Stock Market Dashboard - Treasury Yield Curve, Major world and US Indexes charts, VIX chart, Advance-Decline Lines",,http://www.stock2own.com/,allowed,,,
https://www.stock2own.com/StockMarket/Theory/TechnicalAnalysis,canonicalised,200,text/html; charset=utf-8,Stock Market: Technical Analysis,"Learning Technical Analysis - moving average, stochastic, relative strength (RSI), macd | Stock2Own.com",,http://www.stock2own.com/,allowed,,,
https://www.stock2own.com/StockMarket/Theory,canonicalised,200,text/html; charset=utf-8,Stock Market: Theory,"Stock Market Theory: Value Research and Analysis, Investing Definitions, Stock Analysis.",,http://www.stock2own.com/,allowed,,,
https://www.stock2own.com/About/FAQ,canonicalised,200,text/html; charset=utf-8,Frequently Asked Questions,Stock2Own.com: FAQ,,http://www.stock2own.com/,allowed,,,
https://www.stock2own.com/About/CookiePolicy,canonicalised,200,text/html; charset=utf-8,Stock2Own.com - Cookie Policy | This statement discloses the way stock2own.com uses cookies.,Stock2Own.com: Cookie Policy,,http://www.stock2own.com/,allowed,,,
https://www.stock2own.com/StockMarket/Calendar,canonicalised,200,text/html; charset=utf-8,Stock Market: Economic Calendar,Economic Calendar: upcoming stock earning release dates and all the important events and Economic Indicators.,,http://www.stock2own.com/,allowed,,,
https://www.stock2own.com/StockAnalysis/,canonicalised,200,text/html; charset=utf-8,Stock Analyzer,"S2O Stock Analyzer: stock analysis, price charts in seconds",,http://www.stock2own.com/,allowed,,,
https://www.stock2own.com/About/TermsOfUse,canonicalised,200,text/html; charset=utf-8,Stock2Own.com - Terms of Use | This statement discloses the terms of use of stock2own.com.,Stock2Own.com: Terms of Use,,http://www.stock2own.com/,allowed,,,
https://www.stock2own.com/StockMarket/Theory/FundamentalAnalysis,canonicalised,200,text/html; charset=utf-8,Stock Market: Fundamental Analysis,"Fundamental Analysis: Balance Sheet, Income Statement, Cash Flow Statement, Financial Ratios.",,http://www.stock2own.com/,allowed,,,
https://www.stock2own.com/StockAnalysis/StockLookup,canonicalised,200,text/html; charset=utf-8,Stock and Index Lookup,"Stock Lookup: search stock, index or ETF by name of symbol",,http://www.stock2own.com/,allowed,,,
https://www.stock2own.com/About/News,canonicalised,200,text/html; charset=utf-8,S2O News,Stock2Own.com: News,,http://www.stock2own.com/,allowed,,,
https://www.stock2own.com/About/PrivacyPolicy,canonicalised,200,text/html; charset=utf-8,Stock2Own.com - Privacy Policy | Privacy Policy,Stock2Own.com: Privacy Policy,,http://www.stock2own.com/,allowed,,,
https://www.stock2own.com/StockAnalysis/PopularStocks,canonicalised,200,text/html; charset=utf-8,Popular Stocks and Indexes,"S2O Popular Stocks, Stock Picks | stock2own.com",,http://www.stock2own.com/,allowed,,,
https://www.stock2own.com/About/Features,canonicalised,200,text/html; charset=utf-8,Stock2Own Features,Stock2Own Features: tips on how to use stock2own features,,http://www.stock2own.com/,allowed,,,
https://www.stock2own.com/About/Tutorials/StockAnalyzer/General-Info,canonicalised,200,text/html; charset=utf-8,S2O Stock Analyzer Tutorials: General Info,S2O Stock Analyzer Tutorials: General Info,,http://www.stock2own.com/,allowed,,,
https://www.stock2own.com/StockAnalysis/StockComparison/,canonicalised,200,text/html; charset=utf-8,Stock Comparison,Stock Comparison: compare stocks side by side,,http://www.stock2own.com/,allowed,,,
https://www.stock2own.com/StockMarket/StockBrokers,canonicalised,200,text/html; charset=utf-8,Stock Market: Best Online Stock Brokers,Best Online Stock Brokers | Stock2Own.com,,http://www.stock2own.com/,allowed,,,
https://www.stock2own.com/About/Tutorials/S2O/Features,canonicalised,200,text/html; charset=utf-8,Stock2Own Tutorials: Basic Features,Stock2Own Tutorials: Basic S2O Features.,,http://www.stock2own.com/,allowed,,,
https://www.stock2own.com/InvestingForum,canonicalised,200,text/html; charset=utf-8,S2O Investing Community,"Stock2Own Investing Forum: Stock Research, trading techniques and instruments.",,http://www.stock2own.com/,allowed,,,
https://www.stock2own.com/Investor/Register,canonicalised,200,text/html; charset=utf-8,Create a new Stock2Own Account,"S2O Registration: Watch Lists, stock charts, stock screeners",,http://www.stock2own.com/,allowed,,,
http://www.stock2own.com/,moved permanently,301,text/html; charset=UTF-8,,,,,allowed,https://www.stock2own.com/,,
https://www.stock2own.com/About/MobileApps,canonicalised,200,text/html; charset=utf-8,S2O Mobile Apps,"Stock2Own: S2O Mobile Apps for iPhone, iPad and Android",,http://www.stock2own.com/,allowed,,,
https://www.stock2own.com/InvestingForum/RecentPosts,canonicalised,200,text/html; charset=utf-8,Recent Posts,"S2O Investing Community: stock analysis, investing ideas.",,http://www.stock2own.com/,allowed,,,
https://www.stock2own.com/StockScreener/AIScreener/,canonicalised,200,text/html; charset=utf-8,S2O Stock AI Screener,S2O AI Screener: technical analysis performed by AI,,http://www.stock2own.com/,allowed,,,
https://www.stock2own.com/About/Products,canonicalised,200,text/html; charset=utf-8,Stock2Own Products & Services,"Stock2Own Products: Stock Analyzer, Stock Screener and more",,http://www.stock2own.com/,allowed,,,
https://www.stock2own.com/About/ContactS2O,canonicalised,200,text/html; charset=utf-8,Contact S2O,Stock2Own.com: Contact S2O,,http://www.stock2own.com/,allowed,,,
https://www.stock2own.com/About/Tutorials/StockScreener/Features,canonicalised,200,text/html; charset=utf-8,Stock Screener Tutorials: Basic Features,Stock2Own Tutorials: Basic S2O Stock Screener Features.,,http://www.stock2own.com/,allowed,,,
https://www.stock2own.com/InvestingForum/Search,canonicalised,200,text/html; charset=utf-8,Investing Forum Search,"S2O Investing Community Search: rule #1 stock picks, investing, etfs, options, indexes, investing ideas, market analysis.",,http://www.stock2own.com/,allowed,,,
https://www.stock2own.com/About/Testimonials,canonicalised,200,text/html; charset=utf-8,Testimonials,"Stock2Own.com: Testimonials. S2O - stock picks and analysis, rule #1 stocks, value investing",,http://www.stock2own.com/,allowed,,,
https://www.stock2own.com/About/Tutorials/S2O/Watch-Lists,canonicalised,200,text/html; charset=utf-8,Stock2Own Tutorials: Watch Lists,Stock2Own Tutorials: Watch Lists.,,http://www.stock2own.com/,allowed,,,
https://www.stock2own.com/About,canonicalised,200,text/html; charset=utf-8,About Stock2Own.com,About stock2own.com: complete stock analysis in seconds,,http://www.stock2own.com/,allowed,,,
https://www.stock2own.com/StockMarket/Theory/FundamentalAnalysis/Value-Price,canonicalised,200,text/html; charset=utf-8,Fundamental Analysis: Value Price,Fundamental Analysis. Value Price or fundamental value or Intrinsic Value or sticker price.,,http://www.stock2own.com/,allowed,,,
https://www.stock2own.com/About/SiteMap,canonicalised,200,text/html; charset=utf-8,Site Map,"Stock2Own: Site Map. Stock Picks, Stock Charts, Popular Stocks, Stock Screener, Stock Analyzer.",,http://www.stock2own.com/,allowed,,,
https://www.stock2own.com/StockMarket/Books,canonicalised,200,text/html; charset=utf-8,Stock Market: Books,Stock Market Books | Stock2Own.com,,http://www.stock2own.com/,allowed,,,
https://www.stock2own.com/StockMarket/Gauges/SPDR-Sectors,canonicalised,200,text/html; charset=utf-8,Stock Market Gauges: SPDR ETFs,Stock Market Gauges: Sector SPDR ETFs,,http://www.stock2own.com/,allowed,,,
https://www.stock2own.com/StockMarket/News/Benzinga,canonicalised,200,text/html; charset=utf-8,Stock Market: News,"Stock Market News: MarketWatch, Wall Street Journal, Benzinga and more | stock2own.com",,http://www.stock2own.com/,allowed,,,
https://www.stock2own.com/StockMarket/News/WSJ_Markets,canonicalised,200,text/html; charset=utf-8,Stock Market: News,"Stock Market News: MarketWatch, Wall Street Journal, Benzinga and more | stock2own.com",,http://www.stock2own.com/,allowed,,,
https://www.stock2own.com/StockMarket/Gauges/Indexes,canonicalised,200,text/html; charset=utf-8,Stock Market Gauges: Major Market Index ETFs,Stock Market Gauges: market index ETFs,,http://www.stock2own.com/,allowed,,,
https://www.stock2own.com/StockMarket/News/MarketWatch,canonicalised,200,text/html; charset=utf-8,Stock Market: News,"Stock Market News: MarketWatch, Wall Street Journal, Benzinga and more | stock2own.com",,http://www.stock2own.com/,allowed,,,
https://www.stock2own.com/StockMarket,canonicalised,200,text/html; charset=utf-8,Stock Market,"Stock Market Gauge, Stock Market Calendar, News and Theory on Stock2Own.com.",,http://www.stock2own.com/,allowed,,,
https://www.stock2own.com/StockMarket/News/WSJ_World,canonicalised,200,text/html; charset=utf-8,Stock Market: News,"Stock Market News: MarketWatch, Wall Street Journal, Benzinga and more | stock2own.com",,http://www.stock2own.com/,allowed,,,
https://www.stock2own.com/StockMarket/,canonicalised,200,text/html; charset=utf-8,Stock Market,"Stock Market Gauge, Stock Market Calendar, News and Theory on Stock2Own.com.",,http://www.stock2own.com/,allowed,,,
https://www.stock2own.com/StockMarket/News/WSJ_USBusiness,canonicalised,200,text/html; charset=utf-8,Stock Market: News,"Stock Market News: MarketWatch, Wall Street Journal, Benzinga and more | stock2own.com",,http://www.stock2own.com/,allowed,,,
https://www.stock2own.com/StockMarket/Gauges/Advance-Decline-Line,canonicalised,200,text/html; charset=utf-8,Stock Market Gauges: AD Lines,Stock Market Gauges - Advance-Decline Lines - major market trend indicator,,http://www.stock2own.com/,allowed,,,
https://www.stock2own.com/StockScreener/,canonicalised,200,text/html; charset=utf-8,S2O Stock Screener,S2O Stock Screener: stock picks in seconds | stock2own.com,,http://www.stock2own.com/,allowed,,,
https://www.stock2own.com/StockMarket/Gauges/Fear-Gauge,canonicalised,200,text/html; charset=utf-8,Stock Market Gauges: Market Volatility Index VIX,Stock Market Gauges - VIX - Market Volatility Index (the fear gauge),,http://www.stock2own.com/,allowed,,,
https://www.stock2own.com/StockMarket/Gauges/Treasury-Yield-Curve,canonicalised,200,text/html; charset=utf-8,Stock Market Gauges: Treasury Yield Rates,Stock Market Gauges - Daily Treasury Yield Curve Rates,,http://www.stock2own.com/,allowed,,,
https://www.stock2own.com/About/Tutorials/StockAnalyzer/Financial-Statements,canonicalised,200,text/html; charset=utf-8,S2O Stock Analyzer Tutorials: Financial Statements,S2O Stock Analyzer Tutorials: Financial Statements,,http://www.stock2own.com/,allowed,,,
https://www.stock2own.com/About/Tutorials/StockAnalyzer/Value-Price,canonicalised,200,text/html; charset=utf-8,S2O Stock Analyzer Tutorials: Value Price,S2O Stock Analyzer Tutorials: Value Price (intrinsic value),,http://www.stock2own.com/,allowed,,,
https://www.stock2own.com/About/Tutorials/StockAnalyzer/Growth-Grade-Financial-Ratios,canonicalised,200,text/html; charset=utf-8,S2O Stock Analyzer Tutorials: Growth Grade & Ratios,S2O Stock Analyzer Tutorials: Growth Grade and Financial Ratios,,http://www.stock2own.com/,allowed,,,
https://www.stock2own.com/About/Tutorials/StockScreener/Filter-Set,canonicalised,200,text/html; charset=utf-8,Stock Screener Tutorials: Filter Sets,Stock2Own Tutorials: S2O Stock Screener Filter Sets.,,http://www.stock2own.com/,allowed,,,
https://www.stock2own.com/About/Tutorials/StockAnalyzer/Price-Charts,canonicalised,200,text/html; charset=utf-8,S2O Stock Analyzer Tutorials: Price Charts,S2O Stock Analyzer Tutorials: Price Charts,,http://www.stock2own.com/,allowed,,,
https://www.stock2own.com/StockScreener/MagicScreener/,canonicalised,200,text/html; charset=utf-8,S2O Stock Magic Screener,S2O Magic Formula Screener: inspired by Joel Greenblatt,,http://www.stock2own.com/,allowed,,,
https://www.stock2own.com/StockAnalysis/ETF/US/IEUR,canonicalised,200,text/html; charset=utf-8,iShares Core MSCI Europe ETF,iShares Core MSCI Europe ETF (IEUR) quotes and price charts | Stock2Own.com,,http://www.stock2own.com/,allowed,,,
https://www.stock2own.com/StockAnalysis/ETF/US/IWF,canonicalised,200,text/html; charset=utf-8,iShares Russell 1000 Growth ETF,iShares Russell 1000 Growth ETF (IWF) quotes and price charts | Stock2Own.com,,http://www.stock2own.com/,allowed,,,
https://www.stock2own.com/StockAnalysis/ETF/US/SPY,canonicalised,200,text/html; charset=utf-8,S&P 500 ETF TRUST ETF,S&P 500 ETF TRUST ETF (SPY) quotes and price charts | Stock2Own.com,,http://www.stock2own.com/,allowed,,,
https://www.stock2own.com/StockAnalysis/ETF/US/DIA,canonicalised,200,text/html; charset=utf-8,SPDR Dow Jones Industrial Average ETF,SPDR Dow Jones Industrial Average ETF (DIA) quotes and price charts | Stock2Own.com,,http://www.stock2own.com/,allowed,,,
https://www.stock2own.com/StockAnalysis/ETF/US/SLV,canonicalised,200,text/html; charset=utf-8,iShares Silver Trust,iShares Silver Trust (SLV) quotes and price charts | Stock2Own.com,,http://www.stock2own.com/,allowed,,,
https://www.stock2own.com/StockAnalysis/Index/US/%5EVIX,canonicalised,200,text/html; charset=utf-8,CBOE Market Volatility Index,CBOE Market Volatility Index (VIX) quotes and price charts | Stock2Own.com,,http://www.stock2own.com/,allowed,,,
https://www.stock2own.com/StockAnalysis/ETF/US/EWJ,canonicalised,200,text/html; charset=utf-8,iShares MSCI Japan ETF,iShares MSCI Japan ETF (EWJ) quotes and price charts | Stock2Own.com,,http://www.stock2own.com/,allowed,,,
https://www.stock2own.com/StockAnalysis/ETF/US/IWB,canonicalised,200,text/html; charset=utf-8,iShares Russell 1000 ETF,iShares Russell 1000 ETF (IWB) quotes and price charts | Stock2Own.com,,http://www.stock2own.com/,allowed,,,
https://www.stock2own.com/StockAnalysis/ETF/US/GLD,canonicalised,200,text/html; charset=utf-8,SPDR Gold Shares ETF,SPDR Gold Shares ETF (GLD) quotes and price charts | Stock2Own.com,,http://www.stock2own.com/,allowed,,,
https://www.stock2own.com/StockAnalysis/ETF/US/EWA,canonicalised,200,text/html; charset=utf-8,iShares MSCI Australia ETF,iShares MSCI Australia ETF (EWA) quotes and price charts | Stock2Own.com,,http://www.stock2own.com/,allowed,,,
https://www.stock2own.com/StockMarket/Theory/Gauges,canonicalised,200,text/html; charset=utf-8,Stock Market Gauges | Stock Market Gauges,"Stock Market Gauges: Market Indexes, The Advance-Decline Line, Dow Jones, S&P 500, FTSE, NIKKEI",,http://www.stock2own.com/,allowed,,,
https://www.stock2own.com/StockAnalysis/ETF/US/EEM,canonicalised,200,text/html; charset=utf-8,iShares MSCI Emerging Markets ETF,iShares MSCI Emerging Markets ETF (EEM) quotes and price charts | Stock2Own.com,,http://www.stock2own.com/,allowed,,,
https://www.stock2own.com/StockAnalysis/ETF/US/EWU,canonicalised,200,text/html; charset=utf-8,iShares MSCI United Kingdom ETF,iShares MSCI United Kingdom ETF (EWU) quotes and price charts | Stock2Own.com,,http://www.stock2own.com/,allowed,,,
https://www.stock2own.com/StockAnalysis/ETF/US/UNG,canonicalised,200,text/html; charset=utf-8,United States Natural Gas Fund,United States Natural Gas Fund (UNG) quotes and price charts | Stock2Own.com,,http://www.stock2own.com/,allowed,,,
https://www.stock2own.com/StockMarket/Theory/FundamentalAnalysis/Growth-Grade,canonicalised,200,text/html; charset=utf-8,Fundamental Analysis: Growth Grade,Fundamental Analysis. Historical and Year-over-Year Growth Grade | Stock2Own.com,,http://www.stock2own.com/,allowed,,,
https://www.stock2own.com/StockAnalysis/ETF/US/USO,canonicalised,200,text/html; charset=utf-8,United States Oil Fund,United States Oil Fund (USO) quotes and price charts | Stock2Own.com,,http://www.stock2own.com/,allowed,,,
https://www.stock2own.com/StockMarket/Theory/TechnicalAnalysis/AI,canonicalised,200,text/html; charset=utf-8,Technical Analysis: S2O AI Buy/Sell signals,Learn Technical Analysis - S2O AI Buy/Sell signals | Stock2Own.com,,http://www.stock2own.com/,allowed,,,
https://www.stock2own.com/StockMarket/Theory/Indexes/FTSE/FTSE-100-Index,canonicalised,200,text/html; charset=utf-8,FTSE 100 Index | FTSE 100 Index,Stock Market: Indexes - FTSE 100 Index.,,http://www.stock2own.com/,allowed,,,
https://www.stock2own.com/StockAnalysis/ETF/US/IWD,canonicalised,200,text/html; charset=utf-8,iShares Russell 1000 Value ETF,iShares Russell 1000 Value ETF (IWD) quotes and price charts | Stock2Own.com,,http://www.stock2own.com/,allowed,,,
https://www.stock2own.com/StockMarket/Theory/Indexes/DJI/Dow-Jones-Industrial-Average-Index,canonicalised,200,text/html; charset=utf-8,Dow Jones Industrial Average Index | Dow Jones Industrial Average Index,Stock Market: Indexes - Dow Jones Industrial Average Index.,,http://www.stock2own.com/,allowed,,,
https://www.stock2own.com/StockMarket/Theory/Indexes/NASDAQ/NASDAQ-Composite-Index,canonicalised,200,text/html; charset=utf-8,NASDAQ Composite Index | NASDAQ Composite Index,Stock Market: Indexes - NASDAQ Composite Index.,,http://www.stock2own.com/,allowed,,,
https://www.stock2own.com/StockMarket/Theory/ETF,canonicalised,200,text/html; charset=utf-8,Stock Market: ETPs & ETFs,Stock Market: ETP and ETF - Exchange Traded Products and Exchange Traded Funds on Stock2Own.com.,,http://www.stock2own.com/,allowed,,,
https://www.stock2own.com/StockMarket/Theory/TechnicalAnalysis/Moving-Average,canonicalised,200,text/html; charset=utf-8,Technical Analysis: Moving Average,Learning Technical Analysis - Simple Moving Average | Stock2Own.com,,http://www.stock2own.com/,allowed,,,
https://www.stock2own.com/StockMarket/Theory/Gauges/Gauge_TreasuryYield,canonicalised,200,text/html; charset=utf-8,Stock Market Gauges. Treasury Yield Curve.,Stock Market Gauges: Treasury Yield Curve | stock2own.com,,http://www.stock2own.com/,allowed,,,
https://www.stock2own.com/StockMarket/Theory/TechnicalAnalysis/Bollinger-Bands,canonicalised,200,text/html; charset=utf-8,Technical Analysis: Bollinger Bands,Learning Technical Analysis - Bollinger Bands | Stock2Own.com,,http://www.stock2own.com/,allowed,,,
https://www.stock2own.com/StockAnalysis/ETF/US/IWM,canonicalised,200,text/html; charset=utf-8,iShares Russell 2000 ETF,iShares Russell 2000 ETF (IWM) quotes and price charts | Stock2Own.com,,http://www.stock2own.com/,allowed,,,
https://www.stock2own.com/StockMarket/Theory/TechnicalAnalysis/Exponential-Moving-Average,canonicalised,200,text/html; charset=utf-8,Technical Analysis: Exponential Moving Average,Learning Technical Analysis - Exponential Moving Average | Stock2Own.com,,http://www.stock2own.com/,allowed,,,
https://www.stock2own.com/StockMarket/Theory/TechnicalAnalysis/Candlestick-Chart,canonicalised,200,text/html; charset=utf-8,Technical Analysis: Candlestick chart,Technical Analysis - Candlestick Stock Charts.,,http://www.stock2own.com/,allowed,,,
https://www.stock2own.com/StockMarket/Theory/Indexes/NIKKEI/NIKKEI-225-Index,canonicalised,200,text/html; charset=utf-8,Nikkei 225 Index | Nikkei 225 Index,Stock Market: Indexes - Nikkei 225 Index.,,http://www.stock2own.com/,allowed,,,
https://www.stock2own.com/StockMarket/Theory/TechnicalAnalysis/MACD,canonicalised,200,text/html; charset=utf-8,Technical Analysis: MACD,Learning Technical Analysis - MACD - Moving Average Convergence Divergence | Stock2Own.com,,http://www.stock2own.com/,allowed,,,
https://www.stock2own.com/StockMarket/Theory/Indexes/GSPC/SP-500-Index,canonicalised,200,text/html; charset=utf-8,S&P 500 Index | S&P 500,"Stock Market: Indexes - S&P 500 Index, gauge of the large cap U.S. equities market.",,http://www.stock2own.com/,allowed,,,
https://www.stock2own.com/StockMarket/Theory/Indexes,canonicalised,200,text/html; charset=utf-8,Stock Market: Indexes,Indexes. Basic Info | Stock2Own.com,,http://www.stock2own.com/,allowed,,,
https://www.stock2own.com/StockMarket/Theory/TechnicalAnalysis/Stochastic,canonicalised,200,text/html; charset=utf-8,Technical Analysis: Stochastic,Learn Technical Analysis - Fast and Slow Stochastic | Stock2Own.com,,http://www.stock2own.com/,allowed,,,
https://www.stock2own.com/StockMarket/Theory/TechnicalAnalysis/RSI,canonicalised,200,text/html; charset=utf-8,Technical Analysis: Relative Strength Index (RSI),Learn Technical Analysis - Relative Strength Index (RSI) and Relative Strength (RS) | Stock2Own.com,,http://www.stock2own.com/,allowed,,,
https://www.stock2own.com/StockMarket/Theory/FundamentalAnalysis/Ratios,canonicalised,200,text/html; charset=utf-8,Fundamental Analysis: Financial Ratios,"Stock Market: Fundamental Analysis. Financial Ratios - Current Ratio, PE, PEG, PEGY...",,http://www.stock2own.com/,allowed,,,
https://www.stock2own.com/StockMarket/Theory/FundamentalAnalysis/Graham-Number,canonicalised,200,text/html; charset=utf-8,Fundamental Analysis: Graham Number,Stock Market: Fundamental Analysis. Graham Number.,,http://www.stock2own.com/,allowed,,,
https://www.stock2own.com/StockMarket/Theory/TechnicalAnalysis/Stochastics,canonicalised,200,text/html; charset=utf-8,Stock Market: Technical Analysis,"Learning Technical Analysis - moving average, stochastic, relative strength (RSI), macd | Stock2Own.com",,http://www.stock2own.com/,allowed,,,
https://www.stock2own.com/StockMarket/Theory/FundamentalAnalysis/Growth-Rate,canonicalised,200,text/html; charset=utf-8,Fundamental Analysis: Growth Rate,Fundamental Analysis. Compound Annual Growth Rate (CAGR) | Stock2Own.com,,http://www.stock2own.com/,allowed,,,
https://www.stock2own.com/StockMarket/Theory/Charts,canonicalised,200,text/html; charset=utf-8,Stock Market: Technical Analysis,"Learning Technical Analysis - moving average, stochastic, relative strength (RSI), macd | Stock2Own.com",,http://www.stock2own.com/,allowed,,,
https://www.stock2own.com/About/News/2015,canonicalised,200,text/html; charset=utf-8,S2O News,Stock2Own.com: News,,http://www.stock2own.com/,allowed,,,
https://www.stock2own.com/About/News/2010,canonicalised,200,text/html; charset=utf-8,S2O News,Stock2Own.com: News,,http://www.stock2own.com/,allowed,,,
http://www.stock2own.com/About/Tutorials,moved permanently,301,text/html; charset=UTF-8,,,,,allowed,https://www.stock2own.com/About/Tutorials,,
http://www.stock2own.com/About/Products,moved permanently,301,text/html; charset=UTF-8,,,,,allowed,https://www.stock2own.com/About/Products,,
http://www.stock2own.com/StockAnalysis/,moved permanently,301,text/html; charset=UTF-8,,,,,allowed,https://www.stock2own.com/StockAnalysis/,,
http://www.stock2own.com/StockMarket/Theory/FundamentalAnalysis/Ratios,moved permanently,301,text/html; charset=UTF-8,,,,,allowed,https://www.stock2own.com/StockMarket/Theory/FundamentalAnalysis/Ratios,,
https://www.stock2own.com/About/Features/Investor/Price-Alerts,canonicalised,200,text/html; charset=utf-8,Features: Price Alerts,Watch Lists: Price Alerts.,,http://www.stock2own.com/,allowed,,,
http://www.stock2own.com/About/Features/Investor/Price-Alerts,moved permanently,301,text/html; charset=UTF-8,,,,,allowed,https://www.stock2own.com/About/Features/Investor/Price-Alerts,,
https://www.stock2own.com/StockAnalysis/Stock/US/DSGX/Descartes-Systems-Group-Inc?w=x,canonicalised,200,text/html; charset=utf-8,Descartes Systems Group Inc,"Descartes Systems Group Inc (DSGX) quotes, price charts | Stock2Own.com",,http://www.stock2own.com/,allowed,,,
https://www.stock2own.com/StockAnalysis/Stock/US/FCEL/Fuelcell-Energy-Inc?w=x,canonicalised,200,text/html; charset=utf-8,Fuelcell Energy Inc,"Fuelcell Energy Inc (FCEL) quotes, price charts | Stock2Own.com",,http://www.stock2own.com/,allowed,,,
https://www.stock2own.com/StockAnalysis/Stock/US/NTNX/Nutanix-Inc-Class-A?w=x,canonicalised,200,text/html; charset=utf-8,Nutanix Inc - Class A,"Nutanix Inc - Class A (NTNX) quotes, price charts | Stock2Own.com",,http://www.stock2own.com/,allowed,,,
https://www.stock2own.com/StockAnalysis/Stock/US/LRCDF/LAURENTIAN-BNK-CDA-COM-NPV?w=x,canonicalised,200,text/html; charset=utf-8,LAURENTIAN BNK CDA COM NPV,"LAURENTIAN BNK CDA COM NPV (LRCDF) quotes, price charts | Stock2Own.com",,http://www.stock2own.com/,allowed,,,
https://www.stock2own.com/StockAnalysis/Stock/US/CHWY/Chewy-Inc-Class-A?w=x,canonicalised,200,text/html; charset=utf-8,Chewy Inc - Class A,"Chewy Inc - Class A (CHWY) quotes, price charts | Stock2Own.com",,http://www.stock2own.com/,allowed,,,
https://www.stock2own.com/StockAnalysis/Stock/US/OOMA/Ooma-Inc?w=x,canonicalised,200,text/html; charset=utf-8,Ooma Inc,"Ooma Inc (OOMA) quotes, price charts | Stock2Own.com",,http://www.stock2own.com/,allowed,,,
http://www.stock2own.com/StockScreener/,moved permanently,301,text/html; charset=UTF-8,,,,,allowed,https://www.stock2own.com/StockScreener/,,
https://www.stock2own.com/StockAnalysis/Stock/US/COUP/Coupa-Software-Inc?w=x,canonicalised,200,text/html; charset=utf-8,Coupa Software Inc,"Coupa Software Inc (COUP) quotes, price charts | Stock2Own.com",,http://www.stock2own.com/,allowed,,,
